{
  "evaluation_id": "EVAL-TOPO406-001",
  "claim_id": "CASE-001",
  "proposition": "The sum of two even integers is even.",
  "assumptions": [
    "Both inputs are integers.",
    "Both inputs are even."
  ],
  "derivation": "Let a = 2m and b = 2n, where m and n are integers. Then a + b = 2m + 2n = 2(m + n). Since m + n is an integer, a + b is even.",
  "explanation": "Every even integer is divisible by two. Adding two even integers preserves the common factor of two.",
  "verification_method": "Deductive mathematical proof",
  "results": "The proposition follows from the stated assumptions by algebraic derivation.",
  "counterexamples": [],
  "transfer_conditions": [
    "The inputs must be even integers.",
    "Addition must follow ordinary integer arithmetic."
  ],
  "limitations": [
    "The result concerns integer parity and does not establish unrelated properties of other number systems."
  ],
  "status": "Verified",
  "reviewer": "MathOS documented proof review",
  "revision_history": [
    "2026-10-27: Initial verification record created."
  ]
}
